{
  "comparison_id": "CMP-20261025-105936-AutoGPTvscrewAIvslangchain",
  "timestamp": "2026-10-25T10:59:36.072732+00:00",
  "repository_count": 3,
  "repositories": [
    {
      "identifier": "Significant-Gravitas/AutoGPT",
      "name": "Significant-Gravitas/AutoGPT",
      "url": "https://github.com/Significant-Gravitas/AutoGPT",
      "stars": 187737,
      "forks": 45894,
      "language": "Python",
      "category": "Multi-Agent Systems, Autonomous Swarms, AI Orchestration & MCP Tools",
      "primary_use_case_fit": {
        "summary": "Autonomous, open-ended goal accomplishment requiring multi-step web browsing, file synthesis, and dynamic sub-task decomposition.",
        "sweet_spot": [
          "Autonomous research and unassisted web scraping/data aggregation",
          "Experimental self-prompting agent swarms and algorithmic discovery",
          "Long-running autonomous tasks where exact step execution is unpredictable upfront"
        ],
        "anti_patterns": [
          "Deterministic enterprise backend APIs requiring guaranteed low-latency response times",
          "Strict compliance and auditable financial transaction systems with zero hallucination tolerance",
          "Lightweight embedded or high-throughput microservices where API cost predictability is critical"
        ]
      },
      "architectural_approach": {
        "paradigm": "Autonomous ReAct / Continuous Goal Decomposition Loop",
        "execution_model": "Single/Multi-Agent iterative loop: Thought -> Plan -> Critic -> Action Execution -> Memory Commit",
        "state_management": "Workspace disk scratchpad, vector embeddings local index, and JSON-based context persistence",
        "tool_routing": "Model Context Protocol (MCP) JSON-RPC client, REST API dispatch, and CLI bash execution harness"
      },
      "strengths_and_advantages": [
        "Pioneered accessible autonomous agents with a massive worldwide contributor ecosystem (187k+ stars)",
        "Native Model Context Protocol (MCP) tool integration and standardized plugin ecosystem",
        "Autonomous multi-step execution capable of recovering from execution errors dynamically",
        "Comprehensive visual builder and workflow studio (AutoGPT Platform) for low-code experimentation"
      ],
      "limitations_and_bottlenecks": [
        "High susceptibility to infinite circular reasoning loops and goal drift without strict human intervention",
        "Significant token consumption and compounding API costs on large non-converging goals",
        "Non-deterministic execution paths make unit testing and automated CI regression verification challenging",
        "High runtime latency per goal completion (minutes to tens of minutes)"
      ],
      "ideal_developer_persona": {
        "title": "AI Prototyper, Autonomous Systems Researcher & Automation Hacker",
        "profile": "Developers exploring the boundaries of unsupervised autonomous agent reasoning, web automation, and dynamic task discovery.",
        "cognitive_overhead": "High"
      },
      "licensing_and_deployment": {
        "license": "MIT License",
        "commercial_use": "Fully Permissive - Commercial friendly with attribution",
        "deployment_models": [
          "Docker Container",
          "CLI Local Process",
          "AutoGPT Platform Cloud/Server"
        ],
        "operational_footprint": "Heavy: Requires persistent filesystem workspace, Chroma/vector database, and high LLM token budgets."
      },
      "scores": {
        "production_readiness": 68,
        "architectural_modularity": 82,
        "velocity_ease_of_adoption": 76,
        "ecosystem_integrations": 92,
        "operational_efficiency": 60,
        "composite_score": 76.0
      }
    },
    {
      "identifier": "crewAIInc/crewAI",
      "name": "crewAIInc/crewAI",
      "url": "https://github.com/crewAIInc/crewAI",
      "stars": 60081,
      "forks": 8868,
      "language": "Python",
      "category": "Multi-Agent Systems, Autonomous Swarms, AI Orchestration & MCP Tools",
      "primary_use_case_fit": {
        "summary": "Orchestration of role-playing, collaborative multi-agent teams executing structured corporate and business workflows.",
        "sweet_spot": [
          "Multi-agent content research, writing, review, and editorial pipelines",
          "Role-specialized task handoffs (e.g., Researcher -> Data Analyst -> Compliance Officer)",
          "Rapid enterprise automation where human-like team delegation is the primary mental model"
        ],
        "anti_patterns": [
          "Fine-grained cyclic graph workflows requiring low-level node branching and state machine rollbacks",
          "Low-level model inference serving or tensor-level streaming optimization",
          "Simple single-prompt text transformation tasks where multi-agent overhead adds pure latency"
        ]
      },
      "architectural_approach": {
        "paradigm": "Role-Based Collaborative Multi-Agent Orchestration",
        "execution_model": "Hierarchical (Manager-led) or Sequential task execution with inter-agent communication channels",
        "state_management": "In-memory crew task state, multi-tiered memory (Short-term, Long-term, Entity Memory, User Memory)",
        "tool_routing": "Python decorator-based tool definitions, native LangChain tool wrapping, and direct API invocation"
      },
      "strengths_and_advantages": [
        "Extremely intuitive developer ergonomics: agents defined naturally with Role, Goal, and Backstory",
        "Rapid time-to-first-prototype with batteries-included CLI scaffolding (`crewai create crew`)",
        "Built-in peer review, task delegation mechanisms, and human-in-the-loop checkpoints",
        "Seamless memory architecture with automatic vector-backed entity storage and retrieval"
      ],
      "limitations_and_bottlenecks": [
        "Coarse-grained abstraction layers make micro-managing low-level LLM message history cumbersome",
        "Context window bloat can occur rapidly when multiple agents delegate chatter back and forth",
        "Less granular control over cyclic state graphs compared to lower-level engines like LangGraph",
        "Debugging multi-agent hallucination cascade requires inspecting complex inter-agent transcripts"
      ],
      "ideal_developer_persona": {
        "title": "Product Engineer, Python Software Developer & Enterprise Workflow Builder",
        "profile": "Engineers looking to quickly build structured, production-usable multi-agent automations without getting bogged down in low-level plumbing.",
        "cognitive_overhead": "Low"
      },
      "licensing_and_deployment": {
        "license": "MIT License",
        "commercial_use": "Fully Permissive - Commercial friendly with attribution",
        "deployment_models": [
          "Python Package (pip)",
          "Docker Container",
          "CrewAI Enterprise Cloud Platform"
        ],
        "operational_footprint": "Moderate: In-process Python service with optional vector DB (Chroma/Qdrant) for long-term memory."
      },
      "scores": {
        "production_readiness": 85,
        "architectural_modularity": 84,
        "velocity_ease_of_adoption": 94,
        "ecosystem_integrations": 88,
        "operational_efficiency": 81,
        "composite_score": 86.6
      }
    },
    {
      "identifier": "langchain-ai/langchain",
      "name": "langchain-ai/langchain",
      "url": "https://github.com/langchain-ai/langchain",
      "stars": 148406,
      "forks": 24906,
      "language": "Python",
      "category": "Multi-Agent Systems, Autonomous Swarms, AI Orchestration & MCP Tools",
      "primary_use_case_fit": {
        "summary": "Comprehensive enterprise foundation framework for building composable LLM applications, RAG pipelines, and multi-provider AI services.",
        "sweet_spot": [
          "Enterprise RAG pipelines with complex document chunking, indexing, and hybrid retrieval",
          "Multi-provider LLM abstraction layers (swapping OpenAI, Anthropic, Bedrock, Ollama, HuggingFace)",
          "Full-lifecycle agent engineering paired with LangSmith observability and evaluation"
        ],
        "anti_patterns": [
          "Lightweight scripting where adding a massive dependency tree causes dependency bloat",
          "Beginners seeking zero-configuration 'press start' autonomous agents out-of-the-box",
          "Ultra-minimalist microservices sensitive to package installation size and cold-start latency"
        ]
      },
      "architectural_approach": {
        "paradigm": "Composable Pipeline & Expression Language (LCEL) Architecture",
        "execution_model": "Declarative Directed Acyclic Graph (DAG) pipelines with LangGraph cyclic state machine support",
        "state_management": "Pydantic schema validation, LangGraph persistent checkpoints, external key-value and vector stores",
        "tool_routing": "Structured Pydantic Tool schema contracts, OpenAPI converters, Model Provider native function calling"
      },
      "strengths_and_advantages": [
        "Unrivaled connector ecosystem: 700+ native integrations across models, vector stores, embedders, and APIs",
        "Enterprise-grade observability and tracing integration via LangSmith (industry standard)",
        "LangChain Expression Language (LCEL) provides streaming, async, parallelization, and fallback primitives out-of-the-box",
        "Battle-tested production lineage with extensive corporate enterprise adoption and deep documentation"
      ],
      "limitations_and_bottlenecks": [
        "Steep learning curve due to dense abstractions ('wrappers around wrappers') that obscure underlying prompts",
        "Frequent architectural refactoring and API deprecations (e.g. legacy chains vs LCEL vs LangGraph)",
        "Heavy dependency footprint with potential package resolution conflicts in large codebases",